{
	"$schema": "https://json-schema.org/draft/2020-12/schema",
	"$id": "https://craftarena.local/contracts/simulation_bundle.schema.json",
	"title": "SimulationBundle",
	"description": "v2 TRAPRUSH topology compile of AuthoringWorld. Field list owner: CD-42 §3.4. Pads, two_way/one_way portals, at most one finish occupancy bag, destructible occupancy bags, hazard occupancy bags (cooldown_ticks is the existing component field used as a half-period), always-solid occupancy bags (zone.tags includes solid), pickup occupancy bags (inventory.item_state bomb/dash), and optional movers / conveyors / launches / switches / gates / energy_walls / portal_switches / spikes / flames / crushers / rollers / rubbles / obstacle_cores (not required: compiled v2 without those keys still decodes; movers pose is f(tick, path, speed, loop) and is not a snapshot field; conveyors and launches keep geometry in solids and only carry yaw_bam; switches and gates keep geometry in solids and only carry link_group; energy_walls / rubbles / obstacle_cores keep geometry in destructibles and only carry entity_id; portal_switches keep geometry in portals and only carry link_group; spikes and crushers keep geometry in solids and only carry entity_id; flames stay non-solid in hazards; rollers keep geometry in hazards and follow the existing half-period solid cycle). Dangling portals are omitted. v2 adds the assets bag and gives every occupancy bag an asset_id + gameplay_version reference into it (ADR-0006): the authoritative collision travels with the published content instead of being hardcoded as cell/2 in the loader. Assets are strictly ascending by asset_id and every entry must be referenced. Visual meshes and navigation are never in the bundle; footprint is derived from the collision AABB. v1 bodies are still decoded by game/src/ugc/simulation_bundle.gd and migrated to the built-in lattice-cell asset, but v1 is no longer a valid wire form. The optional environment bag (sky selection, at most one entry) is the only bag that to_dictionary() omits when empty, which is what keeps already-published content byte-identical. Not a signed binary, not a Rule VM graph.",
	"type": "object",
	"additionalProperties": false,
	"required": [
		"schema_version",
		"cell",
		"source_revision",
		"assets",
		"pads",
		"portals",
		"finish",
		"destructibles",
		"hazards",
		"solids",
		"pickups"
	],
	"properties": {
		"schema_version": { "type": "integer", "const": 2 },
		"cell": { "type": "integer", "minimum": 1 },
		"source_revision": { "type": "integer", "minimum": 0 },
		"assets": {
			"type": "array",
			"items": { "$ref": "#/$defs/asset" }
		},
		"pads": {
			"type": "array",
			"items": { "$ref": "#/$defs/pad" }
		},
		"portals": {
			"type": "array",
			"items": { "$ref": "#/$defs/portal" }
		},
		"finish": {
			"type": "array",
			"maxItems": 1,
			"items": { "$ref": "#/$defs/finish" }
		},
		"destructibles": {
			"type": "array",
			"items": { "$ref": "#/$defs/destructible" }
		},
		"hazards": {
			"type": "array",
			"items": { "$ref": "#/$defs/hazard" }
		},
		"solids": {
			"type": "array",
			"items": { "$ref": "#/$defs/solid" }
		},
		"pickups": {
			"type": "array",
			"items": { "$ref": "#/$defs/pickup" }
		},
		"movers": {
			"type": "array",
			"items": { "$ref": "#/$defs/mover" }
		},
		"conveyors": {
			"type": "array",
			"items": { "$ref": "#/$defs/conveyor" }
		},
		"launches": {
			"type": "array",
			"items": { "$ref": "#/$defs/launch" }
		},
		"switches": {
			"type": "array",
			"items": { "$ref": "#/$defs/link_bag" }
		},
		"gates": {
			"type": "array",
			"items": { "$ref": "#/$defs/link_bag" }
		},
		"energy_walls": {
			"type": "array",
			"items": { "$ref": "#/$defs/energy_wall" }
		},
		"portal_switches": {
			"type": "array",
			"items": { "$ref": "#/$defs/link_bag" }
		},
		"spikes": {
			"type": "array",
			"items": { "$ref": "#/$defs/id_bag" }
		},
		"flames": {
			"type": "array",
			"items": { "$ref": "#/$defs/id_bag" }
		},
		"crushers": {
			"type": "array",
			"items": { "$ref": "#/$defs/id_bag" }
		},
		"rollers": {
			"type": "array",
			"items": { "$ref": "#/$defs/id_bag" }
		},
		"rubbles": {
			"type": "array",
			"items": { "$ref": "#/$defs/id_bag" }
		},
		"obstacle_cores": {
			"type": "array",
			"items": { "$ref": "#/$defs/id_bag" }
		},
		"pendulums": {
			"type": "array",
			"items": { "$ref": "#/$defs/id_bag" }
		},
		"ices": {
			"type": "array",
			"items": { "$ref": "#/$defs/conveyor" }
		},
		"environment": {
			"type": "array",
			"maxItems": 1,
			"items": { "$ref": "#/$defs/environment" }
		}
	},
	"$defs": {
		"attach_point": {
			"type": "object",
			"additionalProperties": false,
			"required": ["name", "dx", "dy", "dz"],
			"properties": {
				"name": { "type": "string", "minLength": 1 },
				"dx": { "type": "integer" },
				"dy": { "type": "integer" },
				"dz": { "type": "integer" }
			}
		},
		"asset": {
			"description": "One platform GameplayAsset as it was published: immutable gameplay version plus the authoritative collision and attach points that decide play. Visual mesh is deliberately absent (the client resolves latest by asset_id, so changing visuals produces no new content version). Only box collision has an authoritative static implementation today; the other kinds stay whitelisted at the Schema level but are rejected by TraprushTopologyLoader.",
			"type": "object",
			"additionalProperties": false,
			"required": [
				"asset_id",
				"gameplay_version",
				"collision",
				"attach_points"
			],
			"properties": {
				"asset_id": { "type": "integer", "minimum": 1 },
				"gameplay_version": { "type": "integer", "minimum": 1 },
				"collision": { "$ref": "component_record.schema.json#/$defs/collision_shape" },
				"attach_points": {
					"type": "array",
					"items": { "$ref": "#/$defs/attach_point" }
				}
			}
		},
		"pad": {
			"type": "object",
			"additionalProperties": false,
			"required": [
				"entity_id",
				"x",
				"y",
				"z",
				"order",
				"respawn_dx",
				"respawn_dy",
				"respawn_dz",
				"asset_id",
				"gameplay_version"
			],
			"properties": {
				"entity_id": { "type": "integer", "minimum": 1 },
				"x": { "type": "integer" },
				"y": { "type": "integer" },
				"z": { "type": "integer" },
				"order": { "type": "integer", "minimum": 0 },
				"respawn_dx": { "type": "integer" },
				"respawn_dy": { "type": "integer" },
				"respawn_dz": { "type": "integer" },
				"asset_id": { "type": "integer", "minimum": 1 },
				"gameplay_version": { "type": "integer", "minimum": 1 }
			}
		},
		"finish": {
			"type": "object",
			"additionalProperties": false,
			"required": [
				"entity_id",
				"x",
				"y",
				"z",
				"asset_id",
				"gameplay_version"
			],
			"properties": {
				"entity_id": { "type": "integer", "minimum": 1 },
				"x": { "type": "integer" },
				"y": { "type": "integer" },
				"z": { "type": "integer" },
				"asset_id": { "type": "integer", "minimum": 1 },
				"gameplay_version": { "type": "integer", "minimum": 1 }
			}
		},
		"destructible": {
			"type": "object",
			"additionalProperties": false,
			"required": [
				"entity_id",
				"x",
				"y",
				"z",
				"durability",
				"asset_id",
				"gameplay_version"
			],
			"properties": {
				"entity_id": { "type": "integer", "minimum": 1 },
				"x": { "type": "integer" },
				"y": { "type": "integer" },
				"z": { "type": "integer" },
				"durability": { "type": "integer", "minimum": 0 },
				"asset_id": { "type": "integer", "minimum": 1 },
				"gameplay_version": { "type": "integer", "minimum": 1 }
			}
		},
		"hazard": {
			"type": "object",
			"additionalProperties": false,
			"required": [
				"entity_id",
				"x",
				"y",
				"z",
				"cooldown_ticks",
				"asset_id",
				"gameplay_version"
			],
			"properties": {
				"entity_id": { "type": "integer", "minimum": 1 },
				"x": { "type": "integer" },
				"y": { "type": "integer" },
				"z": { "type": "integer" },
				"cooldown_ticks": { "type": "integer", "minimum": 0 },
				"asset_id": { "type": "integer", "minimum": 1 },
				"gameplay_version": { "type": "integer", "minimum": 1 }
			}
		},
		"solid": {
			"type": "object",
			"additionalProperties": false,
			"required": [
				"entity_id",
				"x",
				"y",
				"z",
				"asset_id",
				"gameplay_version"
			],
			"properties": {
				"entity_id": { "type": "integer", "minimum": 1 },
				"x": { "type": "integer" },
				"y": { "type": "integer" },
				"z": { "type": "integer" },
				"asset_id": { "type": "integer", "minimum": 1 },
				"gameplay_version": { "type": "integer", "minimum": 1 }
			}
		},
		"pickup": {
			"type": "object",
			"additionalProperties": false,
			"required": [
				"entity_id",
				"x",
				"y",
				"z",
				"kind",
				"asset_id",
				"gameplay_version"
			],
			"properties": {
				"entity_id": { "type": "integer", "minimum": 1 },
				"x": { "type": "integer" },
				"y": { "type": "integer" },
				"z": { "type": "integer" },
				"kind": { "type": "string", "enum": ["bomb", "dash"] },
				"asset_id": { "type": "integer", "minimum": 1 },
				"gameplay_version": { "type": "integer", "minimum": 1 }
			}
		},
		"portal": {
			"type": "object",
			"additionalProperties": false,
			"required": [
				"entity_id",
				"target_id",
				"kind",
				"x",
				"y",
				"z",
				"dest_x",
				"dest_y",
				"dest_z",
				"dest_yaw_bam",
				"asset_id",
				"gameplay_version"
			],
			"properties": {
				"entity_id": { "type": "integer", "minimum": 1 },
				"target_id": { "type": "integer", "minimum": 1 },
				"kind": { "type": "string", "enum": ["two_way", "one_way"] },
				"x": { "type": "integer" },
				"y": { "type": "integer" },
				"z": { "type": "integer" },
				"dest_x": { "type": "integer" },
				"dest_y": { "type": "integer" },
				"dest_z": { "type": "integer" },
				"dest_yaw_bam": { "type": "integer" },
				"asset_id": { "type": "integer", "minimum": 1 },
				"gameplay_version": { "type": "integer", "minimum": 1 }
			}
		},
		"conveyor": {
			"description": "A conveyor belt: the geometry is an always-solid bag entry, this bag only carries the push direction. entity_id must also appear in solids; yaw_bam follows the MatchMoveFacing BAM convention (0 = world -Z) and is quantised to four directions at load. Authored as zone.tags including both solid and conveyor plus transform.yaw_bam, so Component Schema v1 is unchanged. Optional: a compiled v2 body without the key still decodes.",
			"type": "object",
			"additionalProperties": false,
			"required": ["entity_id", "yaw_bam"],
			"properties": {
				"entity_id": { "type": "integer", "minimum": 1 },
				"yaw_bam": { "type": "integer", "minimum": 0, "maximum": 65535 }
			}
		},
		"launch": {
			"description": "A launch pad: geometry in solids, this bag only carries yaw_bam. Rising-edge of support applies a vertical impulse plus one cell along the four-way yaw. Same wire shape as conveyor; omit the key to decode as empty. Component Schema v1 is unchanged.",
			"type": "object",
			"additionalProperties": false,
			"required": ["entity_id", "yaw_bam"],
			"properties": {
				"entity_id": { "type": "integer", "minimum": 1 },
				"yaw_bam": { "type": "integer", "minimum": 0, "maximum": 65535 }
			}
		},
		"link_bag": {
			"description": "A pressure switch, a gate, or a gated portal: switches/gates keep geometry in solids; portal_switches keep geometry in portals. This bag only carries interactable.link_group. Occupancy opens the group; walking away closes it the same tick. Omit the key to decode as empty. Component Schema v1 is unchanged.",
			"type": "object",
			"additionalProperties": false,
			"required": ["entity_id", "link_group"],
			"properties": {
				"entity_id": { "type": "integer", "minimum": 1 },
				"link_group": { "type": "integer", "minimum": 0 }
			}
		},
		"energy_wall": {
			"description": "An energy wall: geometry and durability live in destructibles, this bag only carries entity_id. Authored as destructible plus zone.tags including energy_wall. UseItem breaks it like a crate. entity_id must also appear in destructibles. Optional: a compiled v2 body without the key still decodes.",
			"type": "object",
			"additionalProperties": false,
			"required": ["entity_id"],
			"properties": {
				"entity_id": { "type": "integer", "minimum": 1 }
			}
		},
		"environment": {
			"description": "TRAPRUSH sky selection: the 23rd bag and the only one that is omitted when empty, so already-published content that picked no sky keeps producing a byte-identical to_dictionary() and the same ContentHash (constitution article 6). At most one entry: one content, one sky. No geometry, so it registers no asset and is exempt from \"every bag's asset pair must appear in assets\". Only the semantic sky_id travels; the texture path is resolved client-side from game/src/shared/sky_catalog.gd (ADR-0006 Q4 = A). Decode deliberately does NOT check that catalog: published content must be judged by the shape it was published with (ADR-0006 §1.4), so any sky_id >= 0 decodes and an unrecognised one falls back to the default sky at render time. Rejecting unknown ids is the compile-time gate.",
			"type": "object",
			"additionalProperties": false,
			"required": ["entity_id", "sky_id"],
			"properties": {
				"entity_id": { "type": "integer", "minimum": 1 },
				"sky_id": { "type": "integer", "minimum": 0 }
			}
		},
		"id_bag": {
			"description": "Optional occupancy bag that only carries entity_id. Spikes and crushers keep geometry in solids; flames keep geometry in hazards. Optional: a compiled v2 body without the key still decodes.",
			"type": "object",
			"additionalProperties": false,
			"required": ["entity_id"],
			"properties": {
				"entity_id": { "type": "integer", "minimum": 1 }
			}
		},
		"mover": {
			"type": "object",
			"additionalProperties": false,
			"required": ["entity_id", "speed", "loop", "path"],
			"properties": {
				"entity_id": { "type": "integer", "minimum": 1 },
				"speed": { "type": "integer" },
				"loop": { "type": "boolean" },
				"path": {
					"type": "array",
					"minItems": 2,
					"items": {
						"type": "object",
						"additionalProperties": false,
						"required": ["x", "y", "z"],
						"properties": {
							"x": { "type": "integer" },
							"y": { "type": "integer" },
							"z": { "type": "integer" }
						}
					}
				}
			}
		}
	}
}
