{
	"schema_version": 2,
	"cell": 65536,
	"source_revision": 0,
	"assets": [
		{
			"asset_id": 1,
			"gameplay_version": 1,
			"collision": {
				"kind": "box",
				"hx": 32768,
				"hy": 32768,
				"hz": 32768
			},
			"attach_points": []
		}
	],
	"pads": [],
	"portals": [],
	"finish": [],
	"destructibles": [],
	"hazards": [],
	"solids": [
		{
			"entity_id": 80,
			"x": 0,
			"y": -65536,
			"z": 0,
			"asset_id": 1,
			"gameplay_version": 1
		}
	],
	"pickups": [],
	"switches": [
		{
			"entity_id": 80,
			"link_group": 1
		}
	]
}
